{
  "schema_version": "1.0.0",
  "kind": "named_site_reference_capture_ledger",
  "site_id": "seogu_gwangju",
  "capture_mode": "controlled_read_only_reference",
  "plan_identity": {
    "plan_id": "seogu_gwangju.g1.mayor_proposal_guidance.v1",
    "path": "configs/reference-plans/seogu_gwangju_mayor_proposal.json",
    "sha256": "d725dfc07a2f3b81728022bca19ca3ef0b0e6444ee47ee120051f5197b804c0a"
  },
  "g1_completion_claim": true,
  "captured_states": [
    {
      "state_id": "mayor_proposal_guidance.default.desktop",
      "requested_url": "https://www.seogu.gwangju.kr/menu.es?mid=a10401030100",
      "final_url": "https://www.seogu.gwangju.kr/menu.es?mid=a10401030100",
      "captured_at": "2026-08-21T02:11:12.864Z",
      "source_updated_at": null,
      "final_http_status": 200,
      "viewport": {
        "width": 1440,
        "height": 900
      },
      "state": {
        "name": "default"
      },
      "artifacts": [
        {
          "class": "html_dom_content",
          "artifact_id": "data/official_captures/seogu_gwangju/g1/20260821T111106-0900/states/mayor_proposal_guidance.default.desktop/source.html",
          "sha256": "083e7a47d8296f5cf12a964d3bf42744e81c4c1e7ac3148865ad04b079349f98",
          "mime_type": "text/html; charset=utf-8"
        },
        {
          "class": "screenshot",
          "artifact_id": "data/official_captures/seogu_gwangju/g1/20260821T111106-0900/states/mayor_proposal_guidance.default.desktop/source.png",
          "sha256": "9bdc409946271af73f54f117b5d515bd483fdb32ffb5dd42424178c120e8f9d4",
          "mime_type": "image/png",
          "dimensions": {
            "width": 1440,
            "height": 2727
          }
        },
        {
          "class": "visible_region_inventory",
          "artifact_id": "data/official_captures/seogu_gwangju/g1/20260821T111106-0900/states/mayor_proposal_guidance.default.desktop/visible-region-inventory.json",
          "sha256": "29a1eaac496b4f122ef46d57c22495aabaeefeb469d50a5b5de96a74cb0d7e06",
          "mime_type": "application/json"
        },
        {
          "class": "public_asset_provenance",
          "artifact_id": "data/official_captures/seogu_gwangju/g1/20260821T111106-0900/states/mayor_proposal_guidance.default.desktop/public-asset-provenance.json",
          "sha256": "9dce7e448a953d2315633c3f02c3f7cee91c4df352b0624a22d1a864bb5c92b3",
          "mime_type": "application/json"
        }
      ],
      "public_assets": [
        {
          "source_url": "https://www.seogu.gwangju.kr/css/animation.css",
          "artifact_id": "mayor_proposal_guidance.default.desktop/public-asset/001",
          "sha256": "c085e2da2c0e5d1f3d4213f82f0fea8ee975b0809fb954419e8df016a71b0d04",
          "provenance_note": "browser-observed same-host GET; 2526 bytes; text/css"
        },
        {
          "source_url": "https://www.seogu.gwangju.kr/css/basic.css",
          "artifact_id": "mayor_proposal_guidance.default.desktop/public-asset/002",
          "sha256": "d50033d4b17fb7b4f695d22555e657b05ade7807622448a599be67d099cf89d5",
          "provenance_note": "browser-observed same-host GET; 15530 bytes; text/css"
        },
        {
          "source_url": "https://www.seogu.gwangju.kr/css/printArea.css",
          "artifact_id": "mayor_proposal_guidance.default.desktop/public-asset/003",
          "sha256": "157cf9d1a9adc3a5f496a9ceadfe6e9204581b245c4a4687f8069d2d09215937",
          "provenance_note": "browser-observed same-host GET; 19 bytes; text/css"
        },
        {
          "source_url": "https://www.seogu.gwangju.kr/ease_src/sEditor/js/HuskyEZCreator.js",
          "artifact_id": "mayor_proposal_guidance.default.desktop/public-asset/004",
          "sha256": "e7ead7c7f7784adaf5b2848ed9d9e8bd212cbbbcd03ce2d00b075107a681844e",
          "provenance_note": "browser-observed same-host GET; 3582 bytes; text/javascript"
        },
        {
          "source_url": "https://www.seogu.gwangju.kr/font/dingbat_xeicon.css",
          "artifact_id": "mayor_proposal_guidance.default.desktop/public-asset/005",
          "sha256": "67b8414cacdce9849b63726e1a8098aafdacba2aed9d7a2891ba02ecf887d233",
          "provenance_note": "browser-observed same-host GET; 39203 bytes; text/css"
        },
        {
          "source_url": "https://www.seogu.gwangju.kr/font/gmarketsans/GmarketSansBold.woff2",
          "artifact_id": "mayor_proposal_guidance.default.desktop/public-asset/006",
          "sha256": "4c74f4b911eef972f077b70b2823168ae87e96894ef910a84ba562bd4b8c8354",
          "provenance_note": "browser-observed same-host GET; 132116 bytes; font/woff2"
        },
        {
          "source_url": "https://www.seogu.gwangju.kr/font/gmarketsans/GmarketSansMedium.woff2",
          "artifact_id": "mayor_proposal_guidance.default.desktop/public-asset/007",
          "sha256": "3f33802d06439d0d7bf216681eb9460c762418212936906ebf66ef6d7154dd62",
          "provenance_note": "browser-observed same-host GET; 141248 bytes; font/woff2"
        },
        {
          "source_url": "https://www.seogu.gwangju.kr/font/NotoSansKR/NotoSansCJKkr-Bold.woff2",
          "artifact_id": "mayor_proposal_guidance.default.desktop/public-asset/008",
          "sha256": "bc16b83ae5f87730fbed27f810d75fcad341777866b43dd05e0ee03efe040b81",
          "provenance_note": "browser-observed same-host GET; 147824 bytes; font/woff2"
        },
        {
          "source_url": "https://www.seogu.gwangju.kr/font/NotoSansKR/NotoSansCJKkr-DemiLight.woff2",
          "artifact_id": "mayor_proposal_guidance.default.desktop/public-asset/009",
          "sha256": "8c1d60fc42757d152926ed43c829132ab5b8c0ca421a0e9e168b23d55755800b",
          "provenance_note": "browser-observed same-host GET; 144416 bytes; font/woff2"
        },
        {
          "source_url": "https://www.seogu.gwangju.kr/font/NotoSansKR/NotoSansCJKkr-Light.woff2",
          "artifact_id": "mayor_proposal_guidance.default.desktop/public-asset/010",
          "sha256": "0cb9f1d965c896baa64dae6e769181d223f38f73a62396c8d8434ecf174aab5f",
          "provenance_note": "browser-observed same-host GET; 140480 bytes; font/woff2"
        },
        {
          "source_url": "https://www.seogu.gwangju.kr/font/NotoSansKR/NotoSansCJKkr-Medium.woff2",
          "artifact_id": "mayor_proposal_guidance.default.desktop/public-asset/011",
          "sha256": "3f2d313bf322a15b90c069e417f8d176d02ed6df216ab6323fc0792b295c257d",
          "provenance_note": "browser-observed same-host GET; 146044 bytes; font/woff2"
        },
        {
          "source_url": "https://www.seogu.gwangju.kr/font/webfonts_gmarketsans.css",
          "artifact_id": "mayor_proposal_guidance.default.desktop/public-asset/012",
          "sha256": "72a0046c7974742252be03a6e8a23413d889608a047e8e221a712dc2191db930",
          "provenance_note": "browser-observed same-host GET; 684 bytes; text/css"
        },
        {
          "source_url": "https://www.seogu.gwangju.kr/font/xeicon/xeicon.woff2?3ka2yj",
          "artifact_id": "mayor_proposal_guidance.default.desktop/public-asset/013",
          "sha256": "b388035f0a6c34b48927d76634f08f82af556e288c47d7674335371f2deeee8a",
          "provenance_note": "browser-observed same-host GET; 57300 bytes; font/woff2"
        },
        {
          "source_url": "https://www.seogu.gwangju.kr/jquery/css/jquery.bxslider.css?v=20260729",
          "artifact_id": "mayor_proposal_guidance.default.desktop/public-asset/014",
          "sha256": "f9e337fdea0da8912119992f4751a80e50366faed530c3eaff05180c9f1f5d6a",
          "provenance_note": "browser-observed same-host GET; 1706 bytes; text/css"
        },
        {
          "source_url": "https://www.seogu.gwangju.kr/jquery/css/jquery.mCustomScrollbar.min.css?v=2025012112",
          "artifact_id": "mayor_proposal_guidance.default.desktop/public-asset/015",
          "sha256": "247184981eb6f698a94e431a83d68c6b0df623cce57b6e29dc5a6c11e23aa195",
          "provenance_note": "browser-observed same-host GET; 42839 bytes; text/css"
        },
        {
          "source_url": "https://www.seogu.gwangju.kr/jquery/css/slick.css?v=20260729",
          "artifact_id": "mayor_proposal_guidance.default.desktop/public-asset/016",
          "sha256": "35dc4be859335b0576ac8f9bbe5ac96449d1c35501697c0163d678a6c2ba283c",
          "provenance_note": "browser-observed same-host GET; 1336 bytes; text/css"
        },
        {
          "source_url": "https://www.seogu.gwangju.kr/jquery/css/swiper.min.css?v=20260729",
          "artifact_id": "mayor_proposal_guidance.default.desktop/public-asset/017",
          "sha256": "e6792bc2356c88d7cacf7351d64da1e7eaade694b9485daef7f4c84f5844968c",
          "provenance_note": "browser-observed same-host GET; 18431 bytes; text/css"
        },
        {
          "source_url": "https://www.seogu.gwangju.kr/jquery/js/jquery-1.11.2.min.js",
          "artifact_id": "mayor_proposal_guidance.default.desktop/public-asset/018",
          "sha256": "2ecd295d295bec062cedebe177e54b9d6b19fc0a841dc5c178c654c9ccff09c0",
          "provenance_note": "browser-observed same-host GET; 95931 bytes; text/javascript"
        },
        {
          "source_url": "https://www.seogu.gwangju.kr/jquery/js/jquery.bxslider.min.js",
          "artifact_id": "mayor_proposal_guidance.default.desktop/public-asset/019",
          "sha256": "bb9e7dc822c6b7b95a6329932885c72ff2caf74b243fc1c40aca0e858123b83e",
          "provenance_note": "browser-observed same-host GET; 19359 bytes; text/javascript"
        },
        {
          "source_url": "https://www.seogu.gwangju.kr/jquery/js/jquery.mCustomScrollbar.concat.min.js",
          "artifact_id": "mayor_proposal_guidance.default.desktop/public-asset/020",
          "sha256": "fd8027b53a97cbd5782e85c5908e563c39776703ff9279f50658e630927b4167",
          "provenance_note": "browser-observed same-host GET; 45479 bytes; text/javascript"
        },
        {
          "source_url": "https://www.seogu.gwangju.kr/jquery/js/qrcode.min.js",